Date,Title,Upvote,Upvote Ratio
2021-02-08 20:55:38,Microsoft $MSFT stock looking bullish and may have a possible surprise announcement soon!,110,0.64
2021-01-26 13:32:31,MSFT blows away Q2 expectations,669,0.98
2020-12-31 01:56:46,What is your long-term view of MSFT?,64,0.8
2020-11-07 18:06:43,"I have AMZN, FB, and MSFT - I want to drop one and consolidate my positions into two. Which would you choose?",168,0.8
2020-08-28 08:17:31,"With MSFT, AAPL AMZN, GOOGL and FB making up more than 1/5 of the S&P500, what are practical ways to de-risk your portfolio from this imbalance?",1767,0.96
2020-12-26 19:30:08,Diversifying away from MSFT,29,0.77
2020-09-21 06:24:23,MSFT to acquire Bethesda,1483,0.98
2020-09-22 08:23:35,"Video explaining the huge growth of large cap growth stocks (AAPL, AMZN, MSFT, TSLA, FB, GOOGL)",961,0.91
2021-01-27 04:57:43,Microsoft (MSFT) vs Intel (INTC),1,0.54
2020-12-11 17:33:49,MSFT v GOOG,16,0.78
2020-12-10 08:09:06,What is your investment strategy on MSFT? AAPL?,14,0.7
2020-08-03 08:21:17,"With looming Tiktok deal estimated at $50B, MSFT gains 4% or $64B in value",2613,0.97
2020-07-21 12:03:20,"LinkedIn announces 1,000 layoffs ahead of MSFT earnings",2157,0.98
2020-11-17 17:17:44,Cracks in MSFT Azure vs. Amazon AWS a concern?,32,0.77
2020-08-20 10:54:17,"Why is GOOG worth so much less than AAPL, AMZN, MSFT?",183,0.93
2020-10-21 14:53:24,MSFT as a part of your stocks,39,0.76
2020-12-03 11:20:02,"amzn and msft..... popular underperformers, keep or dump?",3,0.58
2020-07-22 07:06:28,$WORK Files EU Competition Complaint Against $MSFT,363,0.95
2020-09-21 11:10:41,"Eleven stocks worth considering today: strong fundamentals, Buy recommendations, (quite) reasonable valuations. AKAM, DG, LMT, MSFT, MRK, UNH, VRTX, WERN, CHE, ICE, CASY.",164,0.9
2020-07-22 13:11:13,"MSFT Earnings: $1.46 per share, adjusted, vs. $1.34 per share as expected by analysts",235,0.96
2020-10-17 09:23:19,What is going on with msft?,0,0.38
2020-04-29 13:26:47,MSFT revenue 35.02B vs 33.99B forecast !,248,0.94
2020-08-27 07:11:45,$MSFT - takeaways from virtual investor meeting at Goldman yesterday,53,0.88
2020-09-15 11:31:31,$MSFT - xCloud will be a game changer,8,0.67
2020-09-11 11:11:51,"Time to dump Apple (AAPL), Tesla (TSLA), and Microsoft (MSFT)?",0,0.36
2020-05-02 18:33:03,"How will GOOG, AMZN, MSFT, AAPL and FB ever lose value?",39,0.72
2020-07-23 22:18:03,What is you Outlook on $MSFT stock after the Downgrade?,10,0.59
2020-07-24 09:17:11,Read throughs from $MSFT's earnings on $AMZN,38,0.89
2020-06-11 09:50:29,AAPL vs MSFT vs NFLX vs MA,12,0.67
2020-05-04 14:47:42,"NVDA/AMD/MSFT/AAPL, which has the most potential for growth?",68,0.82
2021-02-04 05:39:29,10 interesting and useful ETFs with less than $1b AUM,4088,0.98
2020-07-23 15:08:35,MSFT & APPL reasonable entry point,6,0.65
2021-02-23 11:24:56,Watch your P/S Ratio. P/S over 30 is incredibly risky.,417,0.77
2020-08-27 14:20:14,MSFT Stock Split?,0,0.5
2020-07-28 14:23:04,"STX, WDC and other storage companies tanking while AMD, INTL and MSFT pointing to increased server/PC sales",18,0.79
2021-02-09 04:23:19,Second Quarter Results: 6 months into the /r/investing underrated stock survey and the average return was 72% (37% as a portfolio),726,0.97
2021-01-24 05:09:56,I created an algo that tracks the most hyped stocks on Reddit. Here are the results for this week,4253,0.98
2021-02-14 06:50:25,Analysing Institutional Investor Transactions,900,0.96
2021-01-18 21:00:22,"If you had to pick just one of the ""mega-cap"" tech stocks to own - which do you buy?",161,0.87
2020-05-20 17:12:46,Could xCloud be a reason to invest heavily in MSFT?,5,0.62
2020-07-22 10:52:21,Microsoft Flight Simulator 2020 and MSFT,0,0.1
2020-01-13 23:10:31,"Too late to invest in AAPL, MSFT, TSLA ...?",27,0.74
2020-06-05 19:22:01,"Thinking of buying MSFT next week (newb retail trader), any advice would be greatly appreciated on MSFT and any alternate trading strategies",2,0.56
2021-02-11 19:23:35,APXT - The Dark Horse SPAC,81,0.89
2020-08-21 14:16:46,Interactive Tactyc dashboards for FANG + AAPL + MSFT valuations based on Damodaran's latest models,1,0.54
2020-01-23 09:39:41,Why is Vanguard's total US stock market index fund (VTSAX) not market cap weighted right now? Biggest holding is MSFT (not APPL),92,0.88
2020-04-29 17:53:52,MSFT why it's a good investment,1,0.52
2020-04-06 13:53:57,"Puts on ZM , Calls on MSFT",11,0.79
2020-01-29 13:16:31,"FB, MSFT earnings",51,0.86
2021-02-12 10:08:51,The incentive to short TSLA is just massive at this point,33,0.73
2021-01-14 12:33:12,Anyone here buy and hold the most hyped stocks on Reddit from 3-5 years ago? How has that turned out?,331,0.92
2020-04-28 18:40:42,$MSFT Earning Call - Azure?,3,0.62
2020-03-01 20:20:09,Thoughts on MSFT,9,0.67
2019-10-25 16:17:10,MSFT wins $10B contract from the Pentagon,122,0.87
2020-02-14 09:06:47,Dumb to have 100 percent of my portfolio in MSFT?,0,0.4
2020-02-11 06:47:20,Question about when I should sell my 1/15/2021 MSFT call option,4,0.64
2021-01-07 21:27:17,"If you only get 3 stocks to buy and hold for the next five years, what are they?",25,0.61
2021-02-09 19:38:11,Selling Puts to Generate Yield in this Bubbly Market. Talk me out of it!,35,0.9
2019-11-19 02:05:08,MSFT,17,0.79
2020-04-16 07:14:55,Missed out on Microsoft (MSFT)?,0,0.25
2020-04-16 04:07:30,investors.com (IBD) recommended MSFT at $165; now at $171; what to do now?,0,0.25
2020-02-25 16:30:27,What are we think for MSFT near future?,0,0.38
2020-02-23 13:24:14,Thinking about selling MSFT after dividend and putting it into chevron...,0,0.5
2021-02-28 00:05:21,Why Forward and TTM PE ratios have become increasingly irrelevant in today's environment,8,0.69
2020-01-02 17:51:19,"I sold some stock for a total lose of $4500. If I sell MSFT for a gain of $3000, and immediately buy it back, does it mean that I never have to pay taxes on the $3000 gain?",4,0.61
2020-03-02 08:50:32,Microsoft (MSFT) affected by Corona?,0,0.33
2021-02-23 05:48:35,"A ""Stocks for Inflation"" ETF and value factor discussion",19,0.82
2021-02-03 10:39:08,Rate My Portfolio (19 Years Old),8,0.65
2020-02-25 13:09:23,BABA and MSFT,0,0.5
2020-01-02 22:18:33,AAPL or MSFT?,1,0.54
2020-02-04 14:23:41,"If you kept your money in a 1% checking account at the Dot Com peak, woke up and bought TSLA two months ago, you would have a 254% gain, beating both S&P and MSFT by a country mile.",0,0.5
2020-10-27 14:15:10,Microsoft beats on sales and earnings as Azure growth outpaces expectations,1498,0.98
2019-11-24 14:55:40,"Ok, I’m going to try and break away from the Dis, V, WM, MSFT, AMZN thing. What are the most exiting healthcare sector stocks in your mind?",0,0.5
2021-01-01 08:32:50,What would be your list of 10 stocks for a portfolio for 2 kids aged 10 and 7)?,14,0.71
2020-12-27 15:34:58,What do you think about Stanley Druckenmiller's 10 Best Stocks to Buy for 2021?,34,0.78
2020-02-20 08:32:32,Investors not interested in MSFT investment in Mexico?,0,0.22
2020-02-20 13:44:40,Thoughts on short term future of MSFT?,0,0.5
2021-01-23 13:11:35,The FAAMNG'S are back!,35,0.83
2021-01-12 08:48:51,"Fake meat, veganism ETFs?",20,0.71
2020-03-16 20:38:51,Thoughts? Article: MSFT - path to 120,0,0.44
2020-02-06 09:50:39,"Today's Investment - AMD, FB, PYPL, MSFT, MGPI - NOOB FRIENDLY!",0,0.24
2020-01-14 02:05:13,Investing in $MSFT,0,0.33
2019-01-29 08:21:59,"msft, amzn and fb down big today what happened. Any news?",49,0.68
2019-11-15 06:25:56,"I recently noticed many stock have variant symbols. What’s the diff between msft, msft.mx, msft.ba, msft.vi, and msft.sn?",18,0.89
2019-09-18 23:40:54,MSFT announced a new $40 billion share repurchase program,7,0.69
2020-02-14 07:59:12,Will we see MSFT down to $180 ever again?,0,0.44
2018-12-03 14:26:13,"Anyone else annoyed by all the headlines about which company is the most valuable? AMZN, AAPL, MSFT. Why does it matter?",98,0.83
2020-09-13 16:37:15,Microsoft Drops Out of Bidding for TikTok’s U.S. Operations,1022,0.98
2017-06-09 11:57:45,LotS of tech stocks down ~5% ($AAPL; $AMZN;$GOOG;$MSFT;$TSLA;NVDA). What is going on ?,434,0.93
2020-07-31 13:25:53,Microsoft in talks to buy TikTok,1952,0.96
2020-10-18 01:15:59,"Whats the point of broadly diversified portfolie, when there are ETFs?",634,0.92
2019-10-27 12:10:34,$ MSFT Debt forecast question,2,1.0
2019-01-11 17:24:47,"MSFT wins 1.76 billion USD contract with DoD, we'll see if this has any effect on their chances to win the JEDI contract in the future",82,0.9
2019-01-21 15:09:30,"who to pick out of msft, aapl, googl, amzn, nflx?",12,0.6
2020-12-21 04:10:51,Comparing YHOO AND TSLA,15,0.67
2020-11-14 19:00:02,"How high can PLTR go? Or put more succinctly, how big is the market that PLTR is playing in?",117,0.88
2020-09-15 20:22:41,Microsoft announces quarterly dividend increase,813,0.96
2018-07-19 13:57:51,$MSFT Earnings,81,0.93
2021-01-26 13:34:07,What is a good alpha for a Long/Short Tech portfolio?,5,0.78
2019-07-14 09:21:54,"Moves on NFLX, MSFT, EBAY earnings reports",0,0.5
2019-07-14 16:06:43,MSFT Calls for August 8th,1,0.53
2019-02-05 16:46:07,Are the best AI stocks MSFT and NVDA?,7,0.68
2021-01-23 17:05:04,Why would you sell covered calls on a highly volatile stock that you want to hold long term? Aren't you betting against your own intuition and risking your position for pennies on the dollar?,2,0.58
2020-11-13 07:48:43,First Quarter Results: 3 months into the /r/investing underrated stock survey and overall you're up 10-11%,285,0.96
2018-04-17 01:56:47,"Microsoft ($725.09 B) just surpassed Alphabet/Google ($724.96 B) and Amazon ($697.84 B) in market cap, and with augmented reality, cloud computing, and the Surface lineup, MSFT is a BUY",36,0.54
2020-12-25 15:00:29,Should I sell my microsoft stock and buy PLTR?,0,0.48
2021-01-09 06:24:34,The future of the big 5 US tech companies,5,0.62
2019-07-19 09:29:17,What is going on with MSFT?,0,0.4
2020-12-08 13:50:03,The stages of index investing,32,0.83
2021-01-11 08:01:16,Tesla (again),1,0.51
2019-08-05 07:50:20,Just bought some MA and MSFT. Anybody else make some moves today?,0,0.33
2018-02-12 06:54:32,Should you invest in $MSFT,94,0.89
2020-12-15 07:47:42,Short Term Profit Taking Considerations,43,0.87
2021-01-13 12:55:38,Fiverr International Ltd (NYSE:FVRR),11,0.79
2020-10-16 12:47:41,What is the truth behind the statement that very few people are able to beat the market?,217,0.89
2021-01-21 08:10:45,Modern formulas for finding discounted shares?,2,0.63
2020-12-09 09:21:35,C3.ai starts trading above $100 on IPO,26,0.85
2020-05-26 09:27:12,Slack CEO: Microsoft is ‘unhealthily preoccupied with killing us’,2272,0.96
2021-01-16 15:42:29,Thoughts on my new strategy?,0,0.5
2021-01-25 00:25:07,"""Tourism Recovery Portfolio"": When to switch to what I actually want?",1,0.6
2020-08-03 01:39:37,The underrated stock survey! Submit your picks for the community to track,768,0.96
2020-12-12 12:28:11,Categorizing the cloud market,21,0.81
2020-12-22 18:43:24,Which stagnating companies do you believe has the most potential to transform itself in the coming years?,3,0.6
2021-01-16 16:44:40,One critical mistake is made me Bulls over and over in their argument that the market (specifically Nasdaq) is not overvalued,4,0.64
2020-11-25 21:42:34,WHY to exit a position vs. WHEN to exit a position.,30,0.77
2019-03-10 13:44:17,Buying MSFT in Roth IRA,4,0.75
2020-10-23 11:31:34,Are there any studies of the performance of investors who bought and held stocks for 10+ years vs the market?,35,0.86
2021-01-08 05:48:19,Top 10 most traded US stocks by dollar volume on the 7th of january,1,0.56
2020-12-28 18:27:57,Can someone please tell me how dangerous my investing strategy is?,0,0.44
2020-12-25 22:25:53,CSCO + time in market,2,0.58
2017-12-12 05:53:31,"I want to invest in blockchain technology. Other than the major tech players (IBM, MSFT) are there any other players to look at?",15,0.62
2020-11-15 23:08:22,"Softbank exits stake in 24 companies, exits AMZN, GOOG, TSLA",43,0.78
2020-07-12 19:37:03,Why couldn't anyone predict that tech was going to the moon during March?,1242,0.91
2021-01-22 11:43:10,Options -- does this have a chance?,1,0.6
2020-11-12 02:26:40,Goldman Sachs has just boosted its S&P Target. Here's why,38,0.78
2018-03-31 11:31:03,Explain MSFT's valuation,7,0.61
2021-01-12 23:34:47,Buying at the ATH/FOMO,0,0.45
2020-09-03 17:38:23,Stock market bloodbath: Dow and Nasdaq plummet in the worst day since June,257,0.88
2017-05-26 07:51:09,MSFT breaks through $70 a share. Who did what?,74,0.86
2020-10-08 13:03:29,"GameStop Announces Multi-year Strategic Partnership with Microsoft, stock up +45%",122,0.91
2018-11-19 17:07:07,MSFT price falls - time to buy?,7,0.63
2020-08-02 16:59:56,"Over 21 months later, here's how /r/investing performed on the underrated stock survey. Inspired by Mr_Suzan and galloog1.",1150,0.97
2021-01-12 06:58:09,is investing in IPOs always a losing prospect?,1,0.57
2020-08-27 08:22:34,CNBC: Walmart is teaming up with Microsoft on TikTok bid,144,0.94
2020-12-11 15:34:15,DBX,5,0.62
2020-10-17 00:09:38,Why are people saying value investing is dead?,3,0.62
2021-01-14 17:01:46,My Watchlist For 1/15/2021 -- ThinkOrSwim Chart Import Links Included :)!,1,0.56
2020-09-28 12:14:19,Your oldest/newest stocks?,35,0.83
2020-11-07 09:46:55,Nintendo(TYO 7974) Analysis,34,0.8
2020-07-30 13:37:10,"Titan Tech Thursday: Amazon, Google, Facebook, Apple and EA all smash Q2 expectations",139,0.93
2018-04-27 07:57:30,"Positive GDP Revision, Korean War Ending and Denuclearization, and market titans MSFT & AMZN had great quarters. Friday Rally...?",13,0.74
2020-09-11 10:03:34,The underrated stock survey: one month in on /r/investing investing prowess,351,0.96
2018-08-08 15:19:24,Opinions on MSFT,0,0.42
2018-06-05 05:13:20,"MSFT had acquired github company, why apple is not try to take over another big company like netflix?",0,0.3
2020-12-04 16:41:23,Is AMZN the biggest player?,2,0.57
2018-08-12 23:47:09,Stocks such as MSFT/V/AMZN in other sectors,6,0.74
2020-10-21 18:39:58,Microsoft Azure partnering with spaceX,44,0.8
2020-08-28 13:09:41,Hershey: The quintessential Buy-And-Hold stock,168,0.9
2020-08-23 13:04:54,Differences and similarities between 2000 and now.,196,0.92
2020-09-23 12:26:41,"Which green energy companies do you have the biggest positions in, and why?",52,0.84
2013-08-23 06:31:14,"Steve Ballmer retiring, MSFT up 8% at the open",283,0.96
2020-09-19 08:16:37,"Google or Microsoft, Why?",6,0.63
2018-09-21 08:38:43,Better short/long buy: AAPL or MSFT?,0,0.44
2021-01-04 12:29:08,How do you handle changes in currency exchange rates?,0,0.5
2020-10-03 15:23:52,Growth stocks,9,0.75
2020-07-30 00:25:45,"""Strike it big stocks for the next decade"", year 1 retrospective",507,0.96
2020-07-27 03:51:00,Warren Buffett 1997 Email Exchange on Microsoft,102,0.92
2020-09-17 20:11:43,Apple BuyBacks the leading reason for EPS growth?,19,0.67
2020-11-01 11:08:20,Investing Strategies - Dividend Growth Investing - Advantages/Disadvantages + Breakdown,49,0.86
2020-09-24 13:53:57,The stock market is actually not that crazy (change my mind),11,0.6
2020-07-30 15:55:35,"Why did Microsoft crash when Apple, Amazon Google, and Facebook rise?",47,0.75
2015-04-23 14:23:41,"Tech earnings release thread (MSFT, GOOG, AMZN)",113,0.95
2020-08-01 13:56:27,"[WSJ] Sources: Microsoft, which was in advanced talks to buy the US operations of TikTok, has paused negotiations after Trump said on Friday that he opposes the deal — Talks aren't believed to be dead, but the companies are trying to get clarity on White House's stance",295,0.97
2020-12-01 08:06:06,Reason not to use fractional shares?,2,0.67
2018-07-18 09:10:49,Why are stocks like AMZN and MSFT down today?,0,0.21
2020-09-30 15:31:55,Monopolies and Peter Lynch on Beating the Market,15,0.67
2018-07-26 23:45:22,Are these MSFT numbers furreal?,0,0.5
2019-04-03 19:47:00,"Buy Microsoft (MSFT), Not FAANG Stocks for Stable Growth & Income - April 3, 2019 - Zacks.com",0,0.36
2014-11-13 10:26:03,Microsoft (MSFT) is now the second largest company in the world by market cap,101,0.93
2018-01-29 14:20:30,"Earnings Forecast: AMZN, AAPL, FB, MSFT, and GOOGL",5,0.69
2020-08-21 12:11:52,Apple ($AAPL) surge (up 70% YTD),66,0.86
2020-08-02 06:36:07,Microsoft/TikTok deal on hold after presidential opposition - WSJ,175,0.91
2018-07-18 19:14:47,Will $MSFT dip 5-10% after earnings beat expected?,4,0.74
2020-09-23 12:44:44,How bad of an idea would it be to be 100% into tech right now,8,0.61
2018-03-24 07:02:54,FB data breach: Blockchain companies will give the people control over their identities. $IBM $MSFT $INTC $CSCO,0,0.39
2018-07-23 08:26:47,"Right Now I've Taken Care of Major Expenses (House and Car) and Have No Debt. I'm Planning to Hold Stocks for Very Long and Sell Short-term, far OTM Covered Call to Generate a Little Side Income. Is There Major Risk to the Plan? Are MSFT and V Good Options?",0,0.47
2020-09-02 15:18:53,Finally got a stake in AAPL,42,0.69
2018-02-24 19:49:19,"DAL, MU, and MSFT, thoughts?",4,0.69
2020-08-02 16:33:50,Microsoft confirms talks to buy a TikTok,62,0.83
2020-09-14 09:23:19,Oracle wins race to bottom to acquire TikTok US Operations as “trusted partner”,74,0.9
2020-11-28 19:32:09,QuantumScape Might Be A Good Investment,2,0.56
2020-02-04 07:02:19,"If you'd bought Microsoft at the Dot Com peak, you'd have been down by 75% by 2009, in the red until 2016, and up 180% as of today, beating the S&P by a country mile.",1924,0.96
2020-09-19 01:46:23,Story of how I tried to beat the market and failed,18,0.68
2017-12-14 11:06:50,"Investing 50% of Portfolio in: AAPL, GOOGL, FB, MSFT, AMZN",1,0.57
2020-05-16 19:19:37,"If you had to pick a stock simply based off your personal experiences with the company, what company would you buy?",58,0.8
2018-05-23 12:18:23,Thoughts On $MSFT,0,0.47
2020-10-07 16:29:41,"Anti trust probe against AMZN, APPL, GOOG, FB",13,0.7
2014-10-23 13:32:08,"Microsoft (MSFT) beats FYQ1 expectations, $5.84B operating income ($0.54 EPS) on $23.20B revenue",64,0.88
2014-02-04 06:03:09,"Satya NAdella is named new CEO of MSFT, Gates to devote more time to the Co.",151,0.86
2013-10-24 13:13:18,$AMZN and $MSFT up 4% and 7% respectively after reporting,31,0.85
2017-09-17 14:26:58,"Compared to FANG stocks, why isn't MSFT lumped in with them?",4,0.7
2020-02-13 11:16:51,Judge blocks Microsoft Pentagon cloud contract after Amazon suit,1053,0.95
2020-07-02 17:38:38,"Holding cash, I dont know what to do",74,0.83
2014-09-15 03:05:32,MSFT is up +25% since Nadella took it in the right direction,70,0.81
2020-04-24 19:51:48,"Analysis: ""Big 3 Investing"" has beaten the market the past 25 years",253,0.87
2020-05-24 19:23:00,"Regarding NVDA, as well as other chipmakers. Is it a good buy at it's current price?",290,0.86
2020-11-26 04:37:27,Digital Advertisement market to reach $626B by 2026,4,0.75
2018-06-20 09:40:59,Trade in BP for MSFT?,1,0.6
2014-10-30 04:11:00,Opinions for MSFT?,28,0.72
2016-05-25 08:27:18,Why does MSFT have a 40 P/E?,4,0.6
2016-07-19 14:17:23,"Microsoft Crushes Earnings, MSFT Stock Pops",9,0.62
2017-02-21 23:12:29,Index fund or company like MSFT or V,3,0.67
2015-02-09 11:08:54,What do you think of MSFT?,17,0.91
2015-10-20 06:22:47,Should I cash out of my MSFT stock?,10,0.7
2017-05-14 22:00:26,"2k in one stock long term? WMT, T, VZ, MSFT, JD, BABA.",0,0.5
2015-10-23 12:32:14,"$MSFT Up almost 15% in 2 days. Time to take some off the table, or hold on for future gains?",10,0.69
2018-05-16 08:19:13,Why MSFT price volatility is very low?,0,0.4
2020-06-18 19:01:31,Which tech megacap would you pick and why?,16,0.83
2020-09-10 22:05:46,You top 5 stocks,0,0.29
2020-03-31 14:18:20,Amazon and Microsoft actually ended the first quarter higher as most of the market tanked,395,0.97
2015-04-24 09:22:37,Sell MSFT?,5,0.68
2015-07-08 07:48:33,MSFT set to announce huge layoffs,15,0.84
2016-04-22 06:03:29,Planning on buying a bunch of MSFT and GOOG when the market opens. Anyone else have similar plans?,8,0.72
2016-11-23 10:40:25,How soon after the LNKD merger with MSFT will I be able to get my money?,4,0.84
2020-04-26 22:17:46,Why would an investor go long on Futures or Options of a particular stock rather just buying the actual stocks themselves if the investor feels the price will go up?,101,0.9
2015-03-27 10:07:13,MSFT vs. APPL rest of year,12,0.8
2020-08-17 08:58:39,"If Microsoft buys BOX instead of TikTok, wouldn't it be a more business-enterprise oriented move?",3,0.55
2020-06-04 04:18:47,What 3 stocks would you give to your newborn if he can only access it 18 years later?,30,0.81
2020-10-05 07:38:46,Today's Top News,22,0.73
2017-02-02 07:49:25,What's happening to MSFT?,11,0.76
2020-06-14 15:02:55,What 3 main growth stocks would you concentrate your money into with a fresh portfolio of cash?,42,0.73
2013-07-19 13:57:56,I doubled down on MSFT at $31.35. Anyone else feeling lucky?,9,0.66
2020-10-01 04:34:56,Is M1 Finance flawed when it comes to dividend portfolios?,0,0.4
2020-10-05 07:07:03,ETFs Holdings Proprietary,3,0.57
2015-02-13 10:29:19,"Thoughts on CAT, CVX, MSFT?",13,0.71
2020-09-02 19:21:23,Weren't plenty of tech firms profitable before the dot com crash?,0,0.46
2020-07-06 12:14:09,Why don't more companies perform stock splits like Alibaba is doing?,21,0.74
2015-01-29 05:17:03,"How do you guys feel about BABA, YHOO, MSFT?",5,0.73
2020-09-21 12:22:42,"I don't think it's hard to outperform the market, in a 5-15+ year time span if you're only managing small sums of money.",0,0.35
2012-12-03 07:50:41,Any ideas on MSFT?,17,0.84
